OPM_Step,Source_File,Source_Title,Step_narr_in,Step_narr_m_in,Step_narr_out,Step_narr_out_simple,Step_narr_m_out,Step_narr_m_out_simple
P17,ShipFB_S7._Apply_Add-ons.xlsx,S7. Apply Add Ons,"S7. Apply Add-ons-Recording the Lot or Serial # information may be required before an order can be shipped. The Message column in the Line Items list will display the word Lot or Serial when the line on the sale order is for a Lot or Serial control product. To access the Lot or Serial # information for a line, click on the drill-down arrow to access the Shipping Feedback Line Item Details screen. Lot Products: Select the Lot(s) of the products being shipped Serial #'s can be required during both the Receiving process and the Shipping process, or only during the Shipping process. Consequently, a user may be able to select from a list of Available Serial #'s, or may simply need to enter the Serial # manually. If entered manually, be sure to click the Add Select Serial button. Save the Lot or Serial # information. Repeat this process until all Lot and Serial control products being shipped have been properly updated.",,"S7. Apply Add-ons-Recording the Lot or Serial # information may be required before an order can be shipped. The Message column in the Line Items list will display the word Lot or Serial when the line on the sale order is for a Lot or Serial control product. To access the Lot or Serial # information for a line, click on the drill-down arrow to access the Shipping Feedback Line Item Details screen. Lot Products: Select the Lot(s) of the products being shipped Serial #'s can be required during both the Receiving process and the Shipping process, or only during the Shipping process. Consequently, a user may be able to select from a list of Available Serial #'s, or may simply need to enter the Serial # manually. If entered manually, be sure to click the Add Select Serial button. Save the Lot or Serial # information. Repeat this process until all Lot and Serial control products being shipped have been properly updated.","S7. Apply Add-ons. Recording the Lot or Serial # information may be required before an order can be shipped. The Message column Line Items list will display the word Lot or Serial when the line sale order is for. To access the Lot or Serial # information for a line. Click. Drill-down arrow to access the Shipping Feedback Line Item Details. Lot Products:. Select the Lot(s) of the products being shipped Serial #'s can be required during both the Receiving process and the. Consequently, a user may be able to. Select from a list of Available Serial #'s, or may simply need to. Enter the Serial # manually. If entered manually, be sure to. Click the Add. Select Serial. Save the Lot or Serial # information. Repeat this process until all Lot and Serial control products being shipped have been properly updated.",,
P18,ShipFB_S8._Complete_the_Shipping_feed_back_details.xlsx,S8. Complete The Shipping Feed Back Details,"S8. Complete the Shipping feed back details-â€¢ Once the Details have been updated, the user can click the Ship Unship button to ship the order. Repeat the Shipping Feedback process until all orders being shipped have been updated to the Shipped Stage.",,"S8. Complete the Shipping feed back details-â€¢ Once the Details have been updated, the user can click the Ship Unship button to ship the order. Repeat the Shipping Feedback process until all orders being shipped have been updated to the Shipped Stage.","S8. Complete the Shipping feed back details. - Once the Details have been updated, the user can. Click the Ship Unship to ship the order. Repeat the Shipping Feedback process until all orders being shipped have been updated to the Shipped Stage.",,
P19,ShipFB_S9._Ship_the_order.xlsx,S9. Ship The Order,"S9. Ship the order-If you click Ship on the Sales Shipping Feedback Entry window, the shipped date initially defaults to the current date. When you select an order and click Unship, the date is cleared. If it is blank, the date is updated from Sales Entry Invoice Processing Report. This field is required if the order is in Stage 3 (Shipped) or greater. If you are interfacing to a third-party shipping application, the ship date automatically comes from the shipping application",,"S9. Ship the order-If you click Ship on the Sales Shipping Feedback Entry window, the shipped date initially defaults to the current date. When you select an order and click Unship, the date is cleared. If it is blank, the date is updated from Sales Entry Invoice Processing Report. This field is required if the order is in Stage 3 (Shipped) or greater. If you are interfacing to a third-party shipping application, the ship date automatically comes from the shipping application","S9. Ship the order. If you. Click Ship Sales Shipping Feedback Entry window, the shipped date initially defaults to the current date. When you. Select an order and. Click Unship, the date is cleared. If it is blank, the date is updated from Sales Entry Invoice Processing Report. This is required if the order is in Stage 3 (Shipped) or greater. If you are interfacing to a third-party shipping application, the ship date automatically comes shipping application.",,
P20,ShipFB_S999._You_have_successfully_completed_this_SOP.xlsx,S999. You Have Successfully Completed This SOP,S999. You have successfully completed this SOP-Congratulations you have now traversed all the possible paths for this SOP of port to sales order While it is good that you've traversed all the paths what you need to do is to practice and become efficient and be able to translate your current work to the new system Have a nice day,,S999. You have successfully completed this SOP-Congratulations you have now traversed all the possible paths for this SOP of port to sales order While it is good that you've traversed all the paths what you need to do is to practice and become efficient and be able to translate your current work to the new system Have a nice day,S999. You have successfully completed this SOP. Congratulations you have now traversed all the possible paths for this SOP of port to sales order While it is.,,
P21,ShipFB_Y1._Decision_to_initiate_a_physical_count_is_taken.xlsx,Y1. Decision To Initiate A Physical Count Is Taken,Y1. Decision to initiate a physical count is taken-Since there was a shortage of product available to fulfill this order however the system had indicated other wise the discrepancy needs to be investigated,,Y1. Decision to initiate a physical count is taken-Since there was a shortage of product available to fulfill this order however the system had indicated other wise the discrepancy needs to be investigated,Y1. Decision to initiate a physical count is taken. Since there was a shortage of product available to fulfill this order however the system had indicated other wise the.,,
P22,ShipFB_Y2._Yes_this_is_a_lot_or_Serialized_item.xlsx,Y2. Yes This Is A Lot Or Serialized Item,Y2. Yes this is a lot or Serialized item-Being a Serialized or lot controlled these items need to have the serial number s and lot numbers recorded prior to shipping,,Y2. Yes this is a lot or Serialized item-Being a Serialized or lot controlled these items need to have the serial number s and lot numbers recorded prior to shipping,Y2. Yes this is a lot or Serialized item. Being a Serialized or lot controlled these items need to have the serial number s and lot numbers recorded prior.,,
P23,ShipFB_nan.xlsx,Nan,C:\Users\scottuser\Documents\SonetLumier\Input\SE_SLS_Enter_line_Opt2_112025_1211.pptx,,C:\Users\scottuser\Documents\SonetLumier\Input\SE_SLS_Enter_line_Opt2_112025_1211.pptx,C:\Users\scottuser\Documents\SonetLumier\Input\SE_SLS_Enter_line_Opt2_112025_1211.pptx.,,
