Source_PPT,SlideIndex,SelectionTitle,Title,Code,Title_short,Image_sub_url,Deci_Question,Next1_Code,Next2_Code,OPM_Step,Source_File,Source_Title,Step_narr_in,Step_narr_out_simple,Step_narr_out,Step_narr_m_out_simple,Step_narr_m_out,Code-OPM_S,Match_conf
,,,,,,,,,,p16,lineent_s003._pictorial_representation_of_quote_to_cash_-_at_se_electrical_distribution.xlsx,lineent s003. pictorial representation of quote to cash at se electrical distribution,s003. pictorial representation of quote to cash - at se electrical distribution — this slide is aptly named the pictorial representation of quote to cash at scott electric the distribution business while this light is the precursor to the focused area of quote to cache the picture shows how the various phases within that task is directly or indirectly affecting other components within the system for example an inventory is consumed the inventory has to be replenished and that is done by the procure to pay cycle similarly because a sales occurred there has to be accounting for the sale and also at the end of the day collection of the payment against the invoice so hence that goes into the financial side of the impact now because inventory is being both consumed replenished and in some cases being procured and directly shipped to the customer that has a direct impact on how the inventory is managed within the system,s003.,s003. pictorial representation of quote to cash - at se electrical distribution — this slide is aptly named the pictorial representation of quote to cash at scott electric the distribution business while this light is the precursor to the focused area of quote to cache the picture shows how the various phases within that task is directly or indirectly affecting other components within the system for example an inventory is consumed the inventory has to be replenished and that is done by the procure to pay cycle similarly because a sales occurred there has to be accounting for the sale and also at the end of the day collection of the payment against the invoice so hence that goes into the financial side of the impact now because inventory is being both consumed replenished and in some cases being procured and directly shipped to the customer that has a direct impact on how the inventory is managed within the system,,,,
,,,,,,,,,,p17,lineent_s1._easy_line_entry_selected-.xlsx,lineent s1. easy line entry selected,"s1. easy line entry selected- — easy use this mode to conduct a global search for a product. you can use values such as cross-reference values and the product description to search a product. you can add a single line item or multiple line items to the order in this mode. if you specify a price before dropping the line to the grid, it is treated as a price override. the price that is entered is used regardless of what is set up on the product setup or product warehouse product setup record. note: pricing logic is not initiated when you select products in easy line entry mode. if you use pd pricing setup records to set pricing and discounts for most of your products, you can enable alerts about products with associated pd records. select the check for non-standard products in easy and quick line entry option in sales order entry-order entry defaults. some things to note about easy line entry the price that is displayed is based on product records. you can select check for non-standard products in easy and quick line entry in sales order entry-order entry defaults to receive alerts about promotional products that are set up in pd pricing setup and other non-standard and restricted products. hold your mouse over the warning or error icon to view messages. you cannot add products with errors to the order.",s1.,"s1. easy line entry selected- — easy use this mode to conduct a global search for a product. you can use values such as cross-reference values and the product description to search a product. you can add a single line item or multiple line items to the order in this mode. if you specify a price before dropping the line to the grid, it is treated as a price override. the price that is entered is used regardless of what is set up on the product setup or product warehouse product setup record. note: pricing logic is not initiated when you select products in easy line entry mode. if you use pd pricing setup records to set pricing and discounts for most of your products, you can enable alerts about products with associated pd records. select the check for non-standard products in easy and quick line entry option in sales order entry-order entry defaults. some things to note about easy line entry the price that is displayed is based on product records. you can select check for non-standard products in easy and quick line entry in sales order entry-order entry defaults to receive alerts about promotional products that are set up in pd pricing setup and other non-standard and restricted products. hold your mouse over the warning or error icon to view messages. you cannot add products with errors to the order.",,,,
,,,,,,,,,,p18,lineent_s10._quick_line_entry.xlsx,lineent s10. quick line entry,"s10. quick line entry — quick select sales > entry > order. specify the required information on the initiate page, and then click next. select line entry > quick. specify the quantity. specify the product. click add. optionally, change the price or unit. add additional products to the grid. click add lines to add the lines in the grid to the order. finish the order. use this mode to add multiple lines to an order simultaneously. quick line entry requires fewer steps and processing time than single line entry. use this method if you use a scanner to enter products on the order. note: pricing logic is not initiated when you select products in quick line entry mode. if you use pd pricing setup records to set pricing and discounts for most of your products, you can enable alerts about products with associated pd records. select the check for non-standard products in easy and quick line entry option in sales order entry-order entry defaults.",s10.,"s10. quick line entry — quick select sales > entry > order. specify the required information on the initiate page, and then click next. select line entry > quick. specify the quantity. specify the product. click add. optionally, change the price or unit. add additional products to the grid. click add lines to add the lines in the grid to the order. finish the order. use this mode to add multiple lines to an order simultaneously. quick line entry requires fewer steps and processing time than single line entry. use this method if you use a scanner to enter products on the order. note: pricing logic is not initiated when you select products in quick line entry mode. if you use pd pricing setup records to set pricing and discounts for most of your products, you can enable alerts about products with associated pd records. select the check for non-standard products in easy and quick line entry option in sales order entry-order entry defaults.",,,,
,,,,,,,,,,p19,lineent_s11._enter_product_number.xlsx,lineent s11. enter product number,"s11. enter product number — during line entry products are searched in the easy mode the search option is product and within that typing a few characters from the product will bring up matching list and will show you the quantity on hand under :in stock""",s11.,"s11. enter product number — during line entry products are searched in the easy mode the search option is product and within that typing a few characters from the product will bring up matching list and will show you the quantity on hand under :in stock""",,,,
,,,,,,,,,,p20,lineent_s12._enter_quantity_required.xlsx,lineent s12. enter quantity required,s12. enter quantity required — before entering the quantity ensure that the product is available so the delivery requirements of the customer are met,s12.,s12. enter quantity required — before entering the quantity ensure that the product is available so the delivery requirements of the customer are met,,,,
,,,,,,,,,,p21,lineent_s13._enter_price_optional_as_system_would_offer_best_price_for_the_customer-.xlsx,lineent s13. enter price optional as system would offer best price for the customer,s13. enter price optional as system would offer best price for the customer- — price over ride should be an,s13.,s13. enter price optional as system would offer best price for the customer- — price over ride should be an,,,,
,,,,,,,,,,p22,lineent_s14._add_quick_list_lines.xlsx,lineent s14. add quick list lines,"s14. add quick list lines — quick use this mode to add multiple lines to an order simultaneously. quick line entry requires fewer steps and processing time than single line entry. use this method if you use a scanner to enter products on the order. note: pricing logic is not initiated when you select products in quick line entry mode. if you use pd pricing setup records to set pricing and discounts for most of your products, you can enable alerts about products with associated pd records. select the check for non-standard products in easy and quick line entry option in sales order entry-order entry defaults.",s14.,"s14. add quick list lines — quick use this mode to add multiple lines to an order simultaneously. quick line entry requires fewer steps and processing time than single line entry. use this method if you use a scanner to enter products on the order. note: pricing logic is not initiated when you select products in quick line entry mode. if you use pd pricing setup records to set pricing and discounts for most of your products, you can enable alerts about products with associated pd records. select the check for non-standard products in easy and quick line entry option in sales order entry-order entry defaults.",,,,
,,,,,,,,,,p23,lineent_s15._advanced_line_entry_selected.xlsx,lineent s15. advanced line entry selected,"s15. advanced line entry selected — advanced use this mode to add a single line item to the order. in this mode, you can specify additional information that may be required for processing, such as sourcing, serial or lot number assignment, or pricing changes. values for the line item that may differ from the order, such as promise date and rush status, are available in the extended fields section. you can also use this mode to add a printed or internal comment to the line. all line entry modes in sales order entry are available, with these exceptions: on correction orders, only the advanced and return multiple modes are available. on direct orders,only the advanced mode is available. if you specify a product on a line and click finish before you add the line to the order, these events occur: the line is added to the order. the order is completed.",s15.,"s15. advanced line entry selected — advanced use this mode to add a single line item to the order. in this mode, you can specify additional information that may be required for processing, such as sourcing, serial or lot number assignment, or pricing changes. values for the line item that may differ from the order, such as promise date and rush status, are available in the extended fields section. you can also use this mode to add a printed or internal comment to the line. all line entry modes in sales order entry are available, with these exceptions: on correction orders, only the advanced and return multiple modes are available. on direct orders,only the advanced mode is available. if you specify a product on a line and click finish before you add the line to the order, these events occur: the line is added to the order. the order is completed.",,,,
,,,,,,,,,,p24,lineent_s16._enter_product_info.xlsx,lineent s16. enter product info,s16. enter product info,s16.,s16. enter product info,,,,
,,,,,,,,,,p25,lineent_s17._accept_product.xlsx,lineent s17. accept product,s17. accept product — since the product matching the requirement was found the appropriate action can now be taken,s17.,s17. accept product — since the product matching the requirement was found the appropriate action can now be taken,,,,
,,,,,,,,,,p26,lineent_s18._enter_qty_uom.xlsx,lineent s18. enter qty uom,s18. enter qty /uom — enter the quantity and unit of issue,s18.,s18. enter qty /uom — enter the quantity and unit of issue,,,,
,,,,,,,,,,p27,lineent_s19._create_add_kit_components.xlsx,lineent s19. create add kit components,"s19. create add kit components — in sales order entry, you can source single or multiple components for build-on-demand (bod) or nonstock kits. you can tie a stock or nonstock component line to a purchase order or warehouse transfer, including a direct order. if a component of the prebuilt kit is another prebuilt kit, then you can tie the component kit to a work order. kit component sourcing is initiated on the kits page in advanced line entry. you can source one or more components from the multi-comp sourcing page. you can also source a component when you add a component to a kit. if you create a fabricated kit in sales order entry, then you must source the components in kp work order center entry. ties are only created if the quantity ordered is less than the quantity reserved. to create a tie for a component that has the full quantity reserved, add the kit to the sales order without sourcing the component. then, in the kit details section for the component, change the reserved amount for component to less than the quantity needed before creating the tie. the tie is created for the quantity ordered less the quantity reserved. note: you cannot delete a component that is tied to a source document from a sales order. use these instructions to create a tie for one or more components: create a stock order. in advanced line entry, specify the bod or nonstock kit in the product field, and then specify the quantity. click kits. select one or more components to tie to a sourcing document, and then click multi-comp sourcing. specify the product source. complete the remaining fields for the selected product source. when you are sourcing a single component, the arp vendor or warehouse is displayed. when you are sourcing multiple components, the arp vendor or warehouse is not displayed because the arp for each component can be different. click submit, and then click the left arrow to return to advanced line entry. click add to add the line to the order. . finish the order.",s19.,"s19. create add kit components — in sales order entry, you can source single or multiple components for build-on-demand (bod) or nonstock kits. you can tie a stock or nonstock component line to a purchase order or warehouse transfer, including a direct order. if a component of the prebuilt kit is another prebuilt kit, then you can tie the component kit to a work order. kit component sourcing is initiated on the kits page in advanced line entry. you can source one or more components from the multi-comp sourcing page. you can also source a component when you add a component to a kit. if you create a fabricated kit in sales order entry, then you must source the components in kp work order center entry. ties are only created if the quantity ordered is less than the quantity reserved. to create a tie for a component that has the full quantity reserved, add the kit to the sales order without sourcing the component. then, in the kit details section for the component, change the reserved amount for component to less than the quantity needed before creating the tie. the tie is created for the quantity ordered less the quantity reserved. note: you cannot delete a component that is tied to a source document from a sales order. use these instructions to create a tie for one or more components: create a stock order. in advanced line entry, specify the bod or nonstock kit in the product field, and then specify the quantity. click kits. select one or more components to tie to a sourcing document, and then click multi-comp sourcing. specify the product source. complete the remaining fields for the selected product source. when you are sourcing a single component, the arp vendor or warehouse is displayed. when you are sourcing multiple components, the arp vendor or warehouse is not displayed because the arp for each component can be different. click submit, and then click the left arrow to return to advanced line entry. click add to add the line to the order. . finish the order.",,,,
,,,,,,,,,,p28,lineent_s2._search_products_to_add_-.xlsx,lineent s2. search products to add,"s2. search products to add - — during line entry products are searched in the easy mode the search option is product and within that typing a few characters from the product will bring up matching list and will show you the quantity on hand under :in stock""",s2.,"s2. search products to add - — during line entry products are searched in the easy mode the search option is product and within that typing a few characters from the product will bring up matching list and will show you the quantity on hand under :in stock""",,,,
