Source_PPT,SlideIndex,SelectionTitle,Title,Code,Title_short,Image_sub_url,Deci_Question,Next1_Code,Next2_Code,OPM_Step,Source_File,Source_Title,Step_narr_in,Step_narr_out_simple,Step_narr_out,Step_narr_m_out_simple,Step_narr_m_out,Code-OPM_S,Match_conf
SE_SLS_Enter_line_Opt2_251203_1402.pptx,1,| S000. Opening Slide for Sales Order Line Entry Deck,s000. opening slide for sales order line entry deck,s000,opening slide for sales order line entry deck,/images/LineEnt/S000.png,,S001,,,,,,,,,,p13,0.38202247191011235
SE_SLS_Enter_line_Opt2_251203_1402.pptx,2,S001. About Scott Electric and Welcome to Training,s001. about scott electric and welcome to training,s001,about scott electric and welcome to training,/images/LineEnt/S001.png,,S002,,,,,,,,,,p25,0.2916666666666667
SE_SLS_Enter_line_Opt2_251203_1402.pptx,3,S002.  Quote to Cash Work Flow At SE Electrical Distribution,s002. quote to cash work flow at se electrical distribution,s002,quote to cash work flow at se electrical distribution,/images/LineEnt/S002.png,,S003,,,,,,,,,,p31,0.33707865168539325
SE_SLS_Enter_line_Opt2_251203_1402.pptx,4,S003.  Pictorial representation of  Quote to Cash  - At SE Electrical Distribution,s003. pictorial representation of quote to cash - at se electrical distribution,s003,pictorial representation of quote to cash,/images/LineEnt/S003.png,,M1,,,,,,,,,,p6,0.29838709677419356
SE_SLS_Enter_line_Opt2_251203_1402.pptx,5,M1.  Sales Order  Line Entry - At SE Electrical Distribution,m1. sales order line entry - at se electrical distribution,m1,sales order line entry,/images/LineEnt/M1.png,,D1,,,,,,,,,,p31,0.3954802259887006
SE_SLS_Enter_line_Opt2_251203_1402.pptx,6,D1.  A decision on  whether the user want to enter lines  using “Easy” entry - At SE Electrical Distribution,"d1. a decision on whether the user want to enter lines using ""easy"" entry - at se electrical distribution",d1,"a decision on whether the user want to enter lines using ""easy"" entry",/images/LineEnt/D1.png,,Y1,N1,,,,,,,,,p1,0.39919354838709675
SE_SLS_Enter_line_Opt2_251203_1402.pptx,7,Y1.  User has selected  Easy entry - At SE Electrical Distribution,y1. user has selected easy entry - at se electrical distribution,y1,user has selected easy entry,/images/LineEnt/Y1.png,,S1,,,,,,,,,,p24,0.31932773109243695
SE_SLS_Enter_line_Opt2_251203_1402.pptx,8,S1. Easy Line entry Selected- At SE Electrical Distribution,s1. easy line entry selected- at se electrical distribution,s1,easy line entry selected,/images/LineEnt/S1.png,,S2,,,,,,,,,,p24,0.379746835443038
SE_SLS_Enter_line_Opt2_251203_1402.pptx,9,S2. Search Products to add - At SE Electrical Distribution,s2. search products to add - at se electrical distribution,s2,search products to add,/images/LineEnt/S2.png,,S3,,,,,,,,,,pm,0.41025641025641024
SE_SLS_Enter_line_Opt2_251203_1402.pptx,10,S3. Enter the Quantity required - At SE Electrical Distribution,s3. enter the quantity required - at se electrical distribution,s3,enter the quantity required,/images/LineEnt/S3.png,,S4,,,,,,,,,,p26,0.40540540540540543
SE_SLS_Enter_line_Opt2_251203_1402.pptx,11,S4. Add additional product to Sales order - At SE Electrical Distribution,s4. add additional product to sales order - at se electrical distribution,s4,add additional product to sales order,/images/LineEnt/S4.png,,D2,,,,,,,,,,p33,0.4622222222222222
SE_SLS_Enter_line_Opt2_251203_1402.pptx,12,D2. A decision on  whether the user want to enter lines  using “Shopping List” entry - At SE Electrical Distribution,"d2. a decision on whether the user want to enter lines using ""shopping list"" entry - at se electrical distribution",d2,"a decision on whether the user want to enter lines using ""shopping list"" entry",/images/LineEnt/D2.png,,Y2,N2,,,,,,,,,p1,0.4
SE_SLS_Enter_line_Opt2_251203_1402.pptx,13,"Y2. Yes, Line entry using shopping list is being used - At SE Electrical Distribution","y2. yes, line entry using shopping list is being used - at se electrical distribution",y2,"yes, line entry using shopping list is being used",/images/LineEnt/Y2.png,,S5,,,,,,,,,,p41,0.5019011406844106
SE_SLS_Enter_line_Opt2_251203_1402.pptx,14,S5. Shopping List Entry  - At SE Electrical Distribution,s5. shopping list entry - at se electrical distribution,s5,shopping list entry,/images/LineEnt/S5.png,,S6,,,,,,,,,,p24,0.32727272727272727
SE_SLS_Enter_line_Opt2_251203_1402.pptx,15,S6. select shopping list type  - At SE Electrical Distribution,s6. select shopping list type - at se electrical distribution,s6,select shopping list type,/images/LineEnt/S6.png,,S7,,,,,,,,,,p24,0.3
SE_SLS_Enter_line_Opt2_251203_1402.pptx,16,S7. Enter List Criteria  - At SE Electrical Distribution,s7. enter list criteria - at se electrical distribution,s7,enter list criteria,/images/LineEnt/S7.png,,S8,,,,,,,,,,p24,0.36363636363636365
SE_SLS_Enter_line_Opt2_251203_1402.pptx,17,S8. Enter Quantity - At SE Electrical Distribution,s8. enter quantity - at se electrical distribution,s8,enter quantity,/images/LineEnt/S8.png,,S9,,,,,,,,,,p26,0.3851851851851852
SE_SLS_Enter_line_Opt2_251203_1402.pptx,18,S9. Add  additional products to the list - At SE Electrical Distribution,s9. add additional products to the list - at se electrical distribution,s9,add additional products to the list,/images/LineEnt/S9.png,,D3,,,,,,,,,,p38,0.4032258064516129
SE_SLS_Enter_line_Opt2_251203_1402.pptx,19,D3.  A decision on  to enter line items using “Quick” entry  needs to be taken - At SE Electrical Distribution,"d3. a decision on to enter line items using ""quick"" entry needs to be taken - at se electrical distribution",d3,"a decision on to enter line items using ""quick"" entry needs to be taken",/images/LineEnt/D3.png,,Y3,N3,,,,,,,,,p43,0.4198473282442748
SE_SLS_Enter_line_Opt2_251203_1402.pptx,20,"Y3. Yes, Quick line entry was selected - At SE Electrical Distribution","y3. yes, quick line entry was selected - at se electrical distribution",y3,"yes, quick line entry was selected",/images/LineEnt/Y3.png,,S10,,,,,,,,,,p24,0.3595505617977528
SE_SLS_Enter_line_Opt2_251203_1402.pptx,21,S10. Quick line entry  - At SE Electrical Distribution,s10. quick line entry - at se electrical distribution,s10,quick line entry,/images/LineEnt/S10.png,,S11,,,,,,,,,,p24,0.37037037037037035
SE_SLS_Enter_line_Opt2_251203_1402.pptx,22,S11. Enter Product Number - At SE Electrical Distribution,s11. enter product number - at se electrical distribution,s11,enter product number,/images/LineEnt/S11.png,,S12,,,,,,,,,,p24,0.4642857142857143
SE_SLS_Enter_line_Opt2_251203_1402.pptx,23,S12. Enter Quantity required  - At SE Electrical Distribution,s12. enter quantity required - at se electrical distribution,s12,enter quantity required,/images/LineEnt/S12.png,,S13,,,,,,,,,,p26,0.3724137931034483
SE_SLS_Enter_line_Opt2_251203_1402.pptx,24,S13. Enter Price  Optional as system would offer best price for the customer- At SE Electrical Distribution,s13. enter price optional as system would offer best price for the customer- at se electrical distribution,s13,enter price optional as system would offer best price for the customer,/images/LineEnt/S13.png,,D4,,,,,,,,,,p21,0.5791245791245792
SE_SLS_Enter_line_Opt2_251203_1402.pptx,25,D4. Last product? - At SE Electrical Distribution,d4. last product? - at se electrical distribution,d4,last product?,/images/LineEnt/D4.png,,Y4,N4,,,,,,,,,p44,0.3458646616541353
SE_SLS_Enter_line_Opt2_251203_1402.pptx,26,"Y4. Yes, No more products to enter - At SE Electrical Distribution","y4. yes, no more products to enter - at se electrical distribution",y4,"yes, no more products to enter",/images/LineEnt/Y4.png,,S14,,,,,,,,,,p24,0.47058823529411764
SE_SLS_Enter_line_Opt2_251203_1402.pptx,27,S14.  Add Quick List lines  - At SE Electrical Distribution,s14. add quick list lines - at se electrical distribution,s14,add quick list lines,/images/LineEnt/S14.png,,N1,,,,,,,,,,p31,0.3181818181818182
SE_SLS_Enter_line_Opt2_251203_1402.pptx,28,"N1. No, the user is not using Easy line Entry - At SE Electrical Distribution","n1. no, the user is not using easy line entry - at se electrical distribution",n1,"no, the user is not using easy line entry",/images/LineEnt/N1.png,,N2,,,,,,,,,,p8,0.44363636363636366
SE_SLS_Enter_line_Opt2_251203_1402.pptx,29,"N2. No, the user is not using “Shopping List” Entry - At SE Electrical Distribution","n2. no, the user is not using ""shopping list"" entry - at se electrical distribution",n2,"no, the user is not using ""shopping list"" entry",/images/LineEnt/N2.png,,N3,,,,,,,,,,p8,0.3914590747330961
SE_SLS_Enter_line_Opt2_251203_1402.pptx,30,"N3. No, the user is not using “Quick Line” Entry - At SE Electrical Distribution","n3. no, the user is not using ""quick line"" entry - at se electrical distribution",n3,"no, the user is not using ""quick line"" entry",/images/LineEnt/N3.png,,S15,,,,,,,,,,p8,0.39568345323741005
SE_SLS_Enter_line_Opt2_251203_1402.pptx,31,S15. Advanced line entry selected  - At SE Electrical Distribution,s15. advanced line entry selected - at se electrical distribution,s15,advanced line entry selected,/images/LineEnt/S15.png,,S16,,,,,,,,,,p24,0.3614457831325301
SE_SLS_Enter_line_Opt2_251203_1402.pptx,32,S16. Enter Product Info  - At SE Electrical Distribution,s16. enter product info - at se electrical distribution,s16,enter product info,/images/LineEnt/S16.png,,D5,,,,,,,,,,p24,0.5272727272727272
SE_SLS_Enter_line_Opt2_251203_1402.pptx,33,D5. Was Product found ?- At SE Electrical Distribution,d5. was product found ?- at se electrical distribution,d5,was product found ?,/images/LineEnt/D5.png,,Y5,N5,,,,,,,,,p44,0.43478260869565216
SE_SLS_Enter_line_Opt2_251203_1402.pptx,34,"Y5. Yes, Product was found - At SE Electrical Distribution","y5. yes, product was found - at se electrical distribution",y5,"yes, product was found",/images/LineEnt/Y5.png,,S17,,,,,,,,,,p44,0.4647887323943662
SE_SLS_Enter_line_Opt2_251203_1402.pptx,35,S17. Product Selected - At SE Electrical Distribution,s17. product selected - at se electrical distribution,s17,product selected,/images/LineEnt/S17.png,,S18,,,,,,,,,,pm,0.42424242424242425
SE_SLS_Enter_line_Opt2_251203_1402.pptx,36,S18.  Enter Qty /UOM - At SE Electrical Distribution,s18. enter qty /uom - at se electrical distribution,s18,enter qty /uom,/images/LineEnt/S18.png,,D6,,,,,,,,,,p26,0.4117647058823529
SE_SLS_Enter_line_Opt2_251203_1402.pptx,37,D6. Is this a Build on Demand Product? - At SE Electrical Distribution,d6. is this a build on demand product? - at se electrical distribution,d6,is this a build on demand product?,/images/LineEnt/D6.png,,Y6,N6,,,,,,,,,p6,0.49372384937238495
SE_SLS_Enter_line_Opt2_251203_1402.pptx,38,"Y6. Yes, it is a build on Demand Product - At SE Electrical Distribution","y6. yes, it is a build on demand product - at se electrical distribution",y6,"yes, it is a build on demand product",/images/LineEnt/Y6.png,,S19,,,,,,,,,,p45,0.5025641025641026
SE_SLS_Enter_line_Opt2_251203_1402.pptx,39,S19. Create Add Kit Components - At SE Electrical Distribution,s19. create add kit components - at se electrical distribution,s19,create add kit components,/images/LineEnt/S19.png,,S21,,,,,,,,,,p24,0.2905982905982906
SE_SLS_Enter_line_Opt2_251203_1402.pptx,40,S21. Confirm Pricing - At SE Electrical Distribution,s21. confirm pricing - at se electrical distribution,s21,confirm pricing,/images/LineEnt/S21.png,,S22,,,,,,,,,,p24,0.3364485981308411
SE_SLS_Enter_line_Opt2_251203_1402.pptx,41,S22. Add lines to sales order - At SE Electrical Distribution,s22. add lines to sales order - at se electrical distribution,s22,add lines to sales order,/images/LineEnt/S22.png,,N4,,,,,,,,,,p31,0.5
SE_SLS_Enter_line_Opt2_251203_1402.pptx,42,"N4. No, This is not the last item  requested by the customer - At SE Electrical Distribution","n4. no, this is not the last item requested by the customer - at se electrical distribution",n4,"no, this is not the last item requested by the customer",/images/LineEnt/N4.png,,N6,,,,,,,,,,p37,0.38132295719844356
SE_SLS_Enter_line_Opt2_251203_1402.pptx,43,"N6. No, It is not a Build on demand Product - At SE Electrical Distribution","n6. no, it is not a build on demand product - at se electrical distribution",n6,"no, it is not a build on demand product",/images/LineEnt/N6.png,,S21,,,,,,,,,,p45,0.46464646464646464
SE_SLS_Enter_line_Opt2_251203_1402.pptx,44,S21. Confirm Pricing - At SE Electrical Distribution,s21. confirm pricing - at se electrical distribution,s21,confirm pricing,/images/LineEnt/S21.png,,S22,,,,,,,,,,p24,0.3364485981308411
SE_SLS_Enter_line_Opt2_251203_1402.pptx,45,S22. Add lines to sales order - At SE Electrical Distribution,s22. add lines to sales order - at se electrical distribution,s22,add lines to sales order,/images/LineEnt/S22.png,,N5,,,,,,,,,,p31,0.5
SE_SLS_Enter_line_Opt2_251203_1402.pptx,46,"N5. No, Product was not found - At SE Electrical Distribution","n5. no, product was not found - at se electrical distribution",n5,"no, product was not found",/images/LineEnt/N5.png,,S20,,,,,,,,,,p44,0.45871559633027525
SE_SLS_Enter_line_Opt2_251203_1402.pptx,47,S20. Create Non-Stock Product - At SE Electrical Distribution,s20. create non-stock product - at se electrical distribution,s20,create non,/images/LineEnt/S20.png,,S999,,,,,,,,,,p24,0.3448275862068966
SE_SLS_Enter_line_Opt2_251203_1402.pptx,48,S999. You have successfully completed this SOP,s999. you have successfully completed this sop,s999,you have successfully completed this sop,/images/LineEnt/S999.png,,,,,,,,,,,,pm,0.3508771929824561
,,,,,,,,,,p1,lineent_d1._a_decision_on_whether_the_user_want_to_enter_lines_using_easy_entry_-_at_se_.xlsx,lineent d1. a decision on whether the user want to enter lines using easy entry at se,d1. a decision on whether the user want to enter lines using “easy” entry - at se electrical distribution — the user is about to enter the order lines and is faced with the decision on which order entry method best suits the current order hence the question is asked would you like to use easy order entry,d1.,d1. a decision on whether the user want to enter lines using “easy” entry - at se electrical distribution — the user is about to enter the order lines and is faced with the decision on which order entry method best suits the current order hence the question is asked would you like to use easy order entry,,,,
,,,,,,,,,,p2,lineent_d2._a_decision_on_whether_the_user_want_to_enter_lines_using_shopping_list_entry.xlsx,lineent d2. a decision on whether the user want to enter lines using shopping list entry,d2. a decision on whether the user want to enter lines using “shopping list” entry — the user has chosen not to use the easy entry and is now asked if they would lie to use a shopping list,d2.,d2. a decision on whether the user want to enter lines using “shopping list” entry — the user has chosen not to use the easy entry and is now asked if they would lie to use a shopping list,,,,
,,,,,,,,,,p3,lineent_d3._a_decision_on_to_enter_line_items_using_quick_entry_needs_to_be_taken.xlsx,lineent d3. a decision on to enter line items using quick entry needs to be taken,d3. a decision on to enter line items using “quick” entry needs to be taken — the user chose not use the easy entry or the shopping list entry methods so has ot decide if they would like to enter using the quick entry,d3.,d3. a decision on to enter line items using “quick” entry needs to be taken — the user chose not use the easy entry or the shopping list entry methods so has ot decide if they would like to enter using the quick entry,,,,
,,,,,,,,,,p4,lineent_d4._last_product.xlsx,lineent d4. last product,d4. last product? — the user needs to check if this is the last line on the order if so suitable actions need to be taken if not another line would be added,d4.,d4. last product? — the user needs to check if this is the last line on the order if so suitable actions need to be taken if not another line would be added,,,,
,,,,,,,,,,p5,lineent_d5._was_product_found_.xlsx,lineent d5. was product found,d5. was product found ? — the product requested by the customer in not found in the system even though items are constantly added to the catalog from lists provided by the manufacturer some times products may still be not defined hence this decision has to be made,d5.,d5. was product found ? — the product requested by the customer in not found in the system even though items are constantly added to the catalog from lists provided by the manufacturer some times products may still be not defined hence this decision has to be made,,,,
,,,,,,,,,,p6,lineent_d6._is_this_a_build_on_demand_product.xlsx,lineent d6. is this a build on demand product,d6. is this a build on demand product? — a decision needs to be taken if the item selected is a build on demand kit product,d6.,d6. is this a build on demand product? — a decision needs to be taken if the item selected is a build on demand kit product,,,,
,,,,,,,,,,p7,lineent_m1._sales_order_line_entry_-_at_se_electrical_distribution.xlsx,lineent m1. sales order line entry at se electrical distribution,"m1. sales order line entry - at se electrical distribution — use these instructions to enter a stock order (so) for a customer. select sales > entry > order. select stock order in the order type field. complete the remaining fields on the page, and then click next. add line items. see line entry modes. click taxes and totals. verify or complete the tax information. apply any discounts or addons. click recalculate to update the order total. optionally, click freight rate shop to view shipping options. click collect payment. complete the payment information. if you are accepting a cash, check, or credit card payment, verify the journal settings and then click ok. click save to complete the order.",m1.,"m1. sales order line entry - at se electrical distribution — use these instructions to enter a stock order (so) for a customer. select sales > entry > order. select stock order in the order type field. complete the remaining fields on the page, and then click next. add line items. see line entry modes. click taxes and totals. verify or complete the tax information. apply any discounts or addons. click recalculate to update the order total. optionally, click freight rate shop to view shipping options. click collect payment. complete the payment information. if you are accepting a cash, check, or credit card payment, verify the journal settings and then click ok. click save to complete the order.",,,,
,,,,,,,,,,p8,lineent_n1._no_the_user_is_not_using_easy_line_entry.xlsx,lineent n1. no the user is not using easy line entry,"n1. no, the user is not using easy line entry — no the user has chosen not to use the quick line entry hence would move to the next decsion point",n1.,"n1. no, the user is not using easy line entry — no the user has chosen not to use the quick line entry hence would move to the next decsion point",,,,
,,,,,,,,,,p9,lineent_n2._no_the_user_is_not_using_shopping_list_entry.xlsx,lineent n2. no the user is not using shopping list entry,"n2. no, the user is not using “shopping list” entry — no the user is not using a shopping list and so would have to move to the next decision point",n2.,"n2. no, the user is not using “shopping list” entry — no the user is not using a shopping list and so would have to move to the next decision point",,,,
,,,,,,,,,,p10,lineent_n3._no_the_user_is_not_using_quick_line_entry.xlsx,lineent n3. no the user is not using quick line entry,"n3. no, the user is not using “quick line” entry — no the user is not using a quick line entry method and hence has to move to the next decsion block",n3.,"n3. no, the user is not using “quick line” entry — no the user is not using a quick line entry method and hence has to move to the next decsion block",,,,
,,,,,,,,,,p11,lineent_n5._no_product_was_not_found.xlsx,lineent n5. no product was not found,"n5. no, product was not found — no the product was not found hence a non stock item would have to be created using the se specific rules",n5.,"n5. no, product was not found — no the product was not found hence a non stock item would have to be created using the se specific rules",,,,
,,,,,,,,,,p12,lineent_n6._no_it_is_not_a_build_on_demand_product.xlsx,lineent n6. no it is not a build on demand product,"n6. no, it is not a build on demand product — no this is not a build on demand product hence can follow the standard path chosen for line entry",n6.,"n6. no, it is not a build on demand product — no this is not a build on demand product hence can follow the standard path chosen for line entry",,,,
,,,,,,,,,,p13,lineent_s000._opening_slide_for_sales_order_line_entry_deck.xlsx,lineent s000. opening slide for sales order line entry deck,s000. opening slide for sales order line entry deck — this deck of slides or pictures is the quote to order process which is part of quote to cash work flow,s000.,s000. opening slide for sales order line entry deck — this deck of slides or pictures is the quote to order process which is part of quote to cash work flow,,,,
,,,,,,,,,,p14,lineent_s001._about_scott_electric_and_welcome_to_training.xlsx,lineent s001. about scott electric and welcome to training,"s001. about scott electric and welcome to training — scott electric is a leading independent wholesale electrical distributor, serving electrical, mechanical, and general contractors, industrial customers, government agencies, and retail partners. the company provides a broad range of electrical products, lighting, tools, and related services to support both day-to-day operations and long-term projects. welcome to the scott electric training site_x000b_welcome to the scott electric training site. this platform is designed to help you build the knowledge and skills needed to support our customers safely, accurately, and efficiently. here you will find guided learning, reference materials, and role-based courses aligned with how we work every day — in sales, operations, service, administration, and support._x000b_thank you for investing your time in training. your commitment to learning and improvement is an important part of keeping scott electric strong, responsive, and customer-focused.",s001.,"s001. about scott electric and welcome to training — scott electric is a leading independent wholesale electrical distributor, serving electrical, mechanical, and general contractors, industrial customers, government agencies, and retail partners. the company provides a broad range of electrical products, lighting, tools, and related services to support both day-to-day operations and long-term projects. welcome to the scott electric training site_x000b_welcome to the scott electric training site. this platform is designed to help you build the knowledge and skills needed to support our customers safely, accurately, and efficiently. here you will find guided learning, reference materials, and role-based courses aligned with how we work every day — in sales, operations, service, administration, and support._x000b_thank you for investing your time in training. your commitment to learning and improvement is an important part of keeping scott electric strong, responsive, and customer-focused.",,,,
,,,,,,,,,,p15,lineent_s002._quote_to_cash_work_flow_at_se_electrical_distribution.xlsx,lineent s002. quote to cash work flow at se electrical distribution,s002. quote to cash work flow at se electrical distribution — this site is a typical quote to cache representation in what is called a workflow this outlines the various steps performed by various swim lanes if you will or functional groups and provides a overall picture of how we end up serving our customers and continuing to keep our creed of customer comes first,s002.,s002. quote to cash work flow at se electrical distribution — this site is a typical quote to cache representation in what is called a workflow this outlines the various steps performed by various swim lanes if you will or functional groups and provides a overall picture of how we end up serving our customers and continuing to keep our creed of customer comes first,,,,
